<?xml version="1.0" encoding="UTF-8" ?>
<!--
To change this license header, choose License Headers in Project Properties.
To change this template file, choose Tools | Templates
and open the template in the editor.
-->


<ns1:contact
    xmlns:xsi='http://www.w3.org/2001/XMLSchema-instance'
    xmlns:ns1='http://liktek.fr/likacoustik/contact'
    xsi:schemaLocation='http://liktek.fr/likacoustik/contact file:/Users/gauthierlyan/NetBeansProjects/LikacoustikXML/src/java/contact.xsd'>
    
    <ns1:kind>Mr</ns1:kind>
    <ns1:fullname>
        <ns1:firstname>Gauthier</ns1:firstname>
        <ns1:name>LYAN</ns1:name>
    </ns1:fullname>
    <ns1:adress>
        <ns1:street>Le bourg</ns1:street>
        <ns1:zipcode>22 400</ns1:zipcode>
        <ns1:city>Quintenic</ns1:city>
        <ns1:country>France</ns1:country>
    </ns1:adress>
    <ns1:tel>+33 1 04 52 60 63</ns1:tel>
    <ns1:fax>0299303132</ns1:fax>
    <ns1:mail>triton.gauthier@test.fr</ns1:mail>

</ns1:contact>
